{
  "schemaVersion": "0.1.0",
  "provider": "mock",
  "providerVersion": "0.1.0",
  "candidates": [
    {
      "evidenceType": "REGION",
      "id": "01J5M1FXTRESEVM10000000000",
      "pageId": "01J5M1FXTRESPAGEA000000000",
      "geometry": {
        "kind": "rect",
        "x": 72,
        "y": 300,
        "width": 230,
        "height": 80
      },
      "normalizedLabel": "PARAGRAPH_LIKE",
      "providerLabel": "text_block",
      "textPreview": "Left column paragraph part one.",
      "confidence": 0.9,
      "provenanceIds": ["01J5M1FXTRESPR0VM000000000"]
    },
    {
      "evidenceType": "REGION",
      "id": "01J5M1FXTRESEVM20000000000",
      "pageId": "01J5M1FXTRESPAGEA000000000",
      "geometry": {
        "kind": "rect",
        "x": 72,
        "y": 90,
        "width": 468,
        "height": 180
      },
      "normalizedLabel": "FIGURE",
      "providerLabel": "image",
      "confidence": 0.85,
      "provenanceIds": ["01J5M1FXTRESPR0VM000000000"]
    },
    {
      "evidenceType": "FORMULA",
      "id": "01J5M1FXTRESEVF10000000000",
      "pageId": "01J5M1FXTRESPAGEA000000000",
      "geometry": {
        "kind": "rect",
        "x": 72,
        "y": 500,
        "width": 230,
        "height": 30
      },
      "rawText": "E = m c^2",
      "confidence": 0.7,
      "provenanceIds": ["01J5M1FXTRESPR0VF000000000"]
    }
  ],
  "provenance": {
    "records": [
      {
        "id": "01J5M1FXTRESPR0VM000000000",
        "producer": "mock-mineru",
        "producerVersion": "0.1.0",
        "operation": "fixture-region-detection",
        "inputRefs": ["01J5M1FXTRESPHYSD000000000"]
      },
      {
        "id": "01J5M1FXTRESPR0VM000000000",
        "producer": "mock-docling",
        "producerVersion": "0.1.0",
        "operation": "fixture-formula-recognition",
        "inputRefs": ["01J5M1FXTRESPHYSD000000000"]
      }
    ]
  }
}
